mysql> select * from address_book;
+--------+--------+---------+---------+----------+-----------------+--------+
| fname  | lname  | address | city    | phonenum | email           | zip    |
+--------+--------+---------+---------+----------+-----------------+--------+
| Akshay | Zagade | Pune    | Yerwada | 70381030 | AkshayZagade@62 | 411006 |
+--------+--------+---------+---------+----------+-----------------+--------+
1 row in set (0.00 sec)

mysql> update Address_book set fname ='Yogesh';
Query OK, 1 row affected (0.01 sec)
Rows matched: 1  Changed: 1  Warnings: 0

mysql> select * from address_book;
+--------+--------+---------+---------+----------+-----------------+--------+
| fname  | lname  | address | city    | phonenum | email           | zip    |
+--------+--------+---------+---------+----------+-----------------+--------+
| Yogesh | Zagade | Pune    | Yerwada | 70381030 | AkshayZagade@62 | 411006 |
+--------+--------+---------+---------+----------+-----------------+--------+
1 row in set (0.00 sec)

mysql>