

mysql> desc Address_Book;
+----------+-------------+------+-----+---------+-------+
| Field    | Type        | Null | Key | Default | Extra |
+----------+-------------+------+-----+---------+-------+
| fname    | varchar(20) | YES  |     | NULL    |       |
| lname    | varchar(20) | YES  |     | NULL    |       |
| address  | varchar(20) | YES  |     | NULL    |       |
| city     | varchar(20) | YES  |     | NULL    |       |
| phonenum | int         | YES  |     | NULL    |       |
| email    | varchar(20) | YES  |     | NULL    |       |
| zip      | int         | YES  |     | NULL    |       |
| state    | varchar(10) | YES  |     | NULL    |       |
+----------+-------------+------+-----+---------+-------+
8 rows in set (0.00 sec)

mysql> select * from address_book;
+--------+---------+---------+----------+----------+-----------------+--------+-------+
| fname  | lname   | address | city     | phonenum | email           | zip    | state |
+--------+---------+---------+----------+----------+-----------------+--------+-------+
| Suraj  | Garud   | Pune    | Yerwada  | 70381030 | AkshayZagade@62 | 411006 | NULL  |
| Yogesh | Dhangar | Pune    | Whagholi | 70381030 | AkshayZagade@62 | 411006 | NULL  |
| Akshay | Zagade  | Pune    | Kharadi  | 70381030 | AkshayZagade@62 | 411006 | NULL  |
| Akshay | Zagade  | Pune    | Yerwada  | 70381030 | AkshayZagade@62 | 411006 | NULL  |
+--------+---------+---------+----------+----------+-----------------+--------+-------+
4 rows in set (0.00 sec)

mysql> update address_book where state = 'MH';
ERROR 1064 (42000): You have an error in your SQL syntax; check the manual that corresponds to your MySQL server version for the right syntax to use near 'where state = 'MH'' at line 1
mysql> update address_book set state = 'MH';
Query OK, 4 rows affected (0.01 sec)
Rows matched: 4  Changed: 4  Warnings: 0

mysql> select * from address_book;
+--------+---------+---------+----------+----------+-----------------+--------+-------+
| fname  | lname   | address | city     | phonenum | email           | zip    | state |
+--------+---------+---------+----------+----------+-----------------+--------+-------+
| Suraj  | Garud   | Pune    | Yerwada  | 70381030 | AkshayZagade@62 | 411006 | MH    |
| Yogesh | Dhangar | Pune    | Whagholi | 70381030 | AkshayZagade@62 | 411006 | MH    |
| Akshay | Zagade  | Pune    | Kharadi  | 70381030 | AkshayZagade@62 | 411006 | MH    |
| Akshay | Zagade  | Pune    | Yerwada  | 70381030 | AkshayZagade@62 | 411006 | MH    |
+--------+---------+---------+----------+----------+-----------------+--------+-------+
4 rows in set (0.00 sec)

mysql> select * from address_book order by fname ABC;
ERROR 1064 (42000): You have an error in your SQL syntax; check the manual that corresponds to your MySQL server version for the right syntax to use near 'ABC' at line 1
mysql> select * from address_book order by fname ASC;
+--------+---------+---------+----------+----------+-----------------+--------+-------+
| fname  | lname   | address | city     | phonenum | email           | zip    | state |
+--------+---------+---------+----------+----------+-----------------+--------+-------+
| Akshay | Zagade  | Pune    | Kharadi  | 70381030 | AkshayZagade@62 | 411006 | MH    |
| Akshay | Zagade  | Pune    | Yerwada  | 70381030 | AkshayZagade@62 | 411006 | MH    |
| Suraj  | Garud   | Pune    | Yerwada  | 70381030 | AkshayZagade@62 | 411006 | MH    |
| Yogesh | Dhangar | Pune    | Whagholi | 70381030 | AkshayZagade@62 | 411006 | MH    |
+--------+---------+---------+----------+----------+-----------------+--------+-------+
4 rows in set (0.00 sec)